{
  "schema_version": "2.0.0",
  "artifact_type": "10_evidence",
  "investigation_id": "INV-000001",
  "rq_id": "RQ-0007",
  "snapshot_at": "2026-09-19T13:00:00+09:00",
  "evidence_items": [
    {
      "evidence_id": "E0001",
      "content": "The source reports the measured association under the stated study conditions.",
      "source_locator": "p. 12",
      "selection_reason": null,
      "note_type": "Result",
      "direct_quote": null,
      "provenance": {
        "source": {
          "notion_url": "https://www.notion.so/11111111111111111111111111111111",
          "title": null
        },
        "evidence_note": {
          "notion_url": "https://www.notion.so/22222222222222222222222222222222",
          "title": null
        }
      }
    }
  ]
}
