{
  "schema_version": "2.0.0",
  "artifact_type": "10_evidence",
  "investigation_id": "INV-000005",
  "rq_id": "RQ-0016",
  "snapshot_at": "2026-09-22T11:38:11Z",
  "evidence_items": [
    {"evidence_id":"E0001","content":"1831年の願書について山梨県立図書館の解説は、一部の中馬が途中でより運賃のよい荷物を見つけると依頼された荷物を捨てたり、値段のよい駄賃荷物を売却したりする行為があったと説明する。","source_locator":"注記・内容紹介","selection_reason":"受託荷の放棄・売却という運送人側の不正・逸脱リスクを示す地域事例として選択した。","note_type":"Data","direct_quote":null,"provenance":{"source":{"notion_url":"https://app.notion.com/p/3e3e5855be3981b3a260e7d48cdf80cf","title":"中馬不当行為により荷物勝手附送り方願書"},"evidence_note":{"notion_url":"https://app.notion.com/p/3e3e5855be3981bdb809e537f400be9c","title":"EV-0088"}}},
    {"evidence_id":"E0002","content":"1831年の「中馬不当行為により荷物勝手附送り方願書」は、韮崎宿を抱える河原部村から諏訪伊勢守役所へ、中馬による運搬の自由と安全を求めて提出された願書である。","source_locator":"注記・内容紹介","selection_reason":"運送安全を行政へ求めた史料の性格と統制要求を示すため。","note_type":"Data","direct_quote":null,"provenance":{"source":{"notion_url":"https://app.notion.com/p/3e3e5855be3981b3a260e7d48cdf80cf","title":"中馬不当行為により荷物勝手附送り方願書"},"evidence_note":{"notion_url":"https://app.notion.com/p/3e3e5855be398150bc87c397c8a14a4b","title":"EV-0089"}}},
    {"evidence_id":"E0003","content":"原沢文弥は、江戸期の公用宿駅制度で私的な旅客・商人荷物が宿駅ごとに積み替えられ、その積替えが荷物の損傷、運送遅延、運賃・手数料の増加という欠点を伴ったと論じる。","source_locator":"抄録","selection_reason":"積替え自体が損傷・遅延リスクだったことを示すため。","note_type":"Claim","direct_quote":null,"provenance":{"source":{"notion_url":"https://app.notion.com/p/3e3e5855be3981ada310de6f492b01c9","title":"江戸時代における宿駅と脇道往還交通との関係について"},"evidence_note":{"notion_url":"https://app.notion.com/p/3e3e5855be39811da7e6d9ff1849fa82","title":"EV-0090"}}},
    {"evidence_id":"E0004","content":"原沢文弥は、宿継輸送の不便を避けるため、近世中後期に民間運送業者による馬・牛の通し運送が発達し、途中の宿駅を避けたり脇道を利用したりする輸送が増加したと論じる。","source_locator":"抄録","selection_reason":"経路変更・脇道利用を一律に不正とみなせないことを検証するため。","note_type":"Claim","direct_quote":null,"provenance":{"source":{"notion_url":"https://app.notion.com/p/3e3e5855be3981ada310de6f492b01c9","title":"江戸時代における宿駅と脇道往還交通との関係について"},"evidence_note":{"notion_url":"https://app.notion.com/p/3e3e5855be398198a43deccccf9f5150","title":"EV-0091"}}},
    {"evidence_id":"E0005","content":"1804年の「通馬渡方覚」は、宿場ごとに荷を継ぎ替えず同じ馬で目的地まで運ぶ通し馬について、親方別に渡し先、馬数、個々の馬方名を割り当てて記録している。","source_locator":"資料解説","selection_reason":"通し運送で担当者・渡し先・馬数を記録する実務を示すため。","note_type":"Data","direct_quote":null,"provenance":{"source":{"notion_url":"https://app.notion.com/p/3e3e5855be398134be72e877ddc24022","title":"通馬渡方覚"},"evidence_note":{"notion_url":"https://app.notion.com/p/3e3e5855be398113b4d7d5c74146831d","title":"EV-0092"}}},
    {"evidence_id":"E0006","content":"1876年の内国通運会社規則は、分社が担当する道筋を往復する荷物および本社から受け取った荷物について、引受中の事故・紛争をその担当分社の責任と定めていた。","source_locator":"p.26-27相当・水谷家文書26Q26-22「明治九年十月十二日付 内国通運会社規則」","selection_reason":"区間単位の責任主体を明示する統制を示すため。","note_type":"Data","direct_quote":null,"provenance":{"source":{"notion_url":"https://app.notion.com/p/3e3e5855be398120820cf783f5015623","title":"明治初期における水谷久右衛門（旧飛脚問屋）による廻漕会社参加と内国通運松阪分社営業"},"evidence_note":{"notion_url":"https://app.notion.com/p/3e3e5855be3981e39b24df0ababcd007","title":"EV-0093"}}},
    {"evidence_id":"E0007","content":"1876年の内国通運会社規則は、分社に対し、担当荷物の弁償準備として事業量に応じ300円から3000円の抵当品を本社へ差し出すことを定めていた。","source_locator":"p.26-27相当・水谷家文書26Q26-22「明治九年十月十二日付 内国通運会社規則」","selection_reason":"事故時の弁償可能性を担保する財務統制を示すため。","note_type":"Data","direct_quote":null,"provenance":{"source":{"notion_url":"https://app.notion.com/p/3e3e5855be398120820cf783f5015623","title":"明治初期における水谷久右衛門（旧飛脚問屋）による廻漕会社参加と内国通運松阪分社営業"},"evidence_note":{"notion_url":"https://app.notion.com/p/3e3e5855be39811383a2da04239bc738","title":"EV-0094"}}},
    {"evidence_id":"E0008","content":"巻島隆の整理によれば、1876年の松阪通運人馬継立所では本道だけでなく枝道・枝々道の人足賃銭も規定され、1879年には三重県内の脇往還にも内国通運会社の継立所が設置されていた。","source_locator":"p.28-29相当・表3および表4の解説","selection_reason":"本道以外の経路も正式な運送網に組み込まれ得たことを示すため。","note_type":"Data","direct_quote":null,"provenance":{"source":{"notion_url":"https://app.notion.com/p/3e3e5855be398120820cf783f5015623","title":"明治初期における水谷久右衛門（旧飛脚問屋）による廻漕会社参加と内国通運松阪分社営業"},"evidence_note":{"notion_url":"https://app.notion.com/p/3e3e5855be3981d2ae81f72264317767","title":"EV-0095"}}},
    {"evidence_id":"E0009","content":"1896年の大審院「詐欺取財ノ件」は、被告らが共謀して襤褸荷と生糸荷を掏り替え、内国通運会社が銀行の依頼で保管していた生糸荷が騙取されたとされた事件を扱っている。","source_locator":"判決本文","selection_reason":"入れ替えリスクの実在を示す事例Evidenceとして選択し、一般慣行の根拠には用いない。","note_type":"Data","direct_quote":null,"provenance":{"source":{"notion_url":"https://app.notion.com/p/3e3e5855be398133b695d73273e232cd","title":"詐欺取財ノ件（明治29年第558号）"},"evidence_note":{"notion_url":"https://app.notion.com/p/3e3e5855be3981deb2fddeee11c1d80b","title":"EV-0096"}}},
    {"evidence_id":"E0010","content":"1899年商法338条は、貨幣・有価証券その他の高価品について、荷送人が運送委託時に種類と価額を明告しなければ運送人は損害賠償責任を負わないと定めた。","source_locator":"第338条","selection_reason":"高価品のリスク情報を事前申告させる責任条件を示すため。","note_type":"Data","direct_quote":null,"provenance":{"source":{"notion_url":"https://app.notion.com/p/3e3e5855be3981afa766c378de85f6b3","title":"商法（明治32年法律第48号）— 法令データベース"},"evidence_note":{"notion_url":"https://app.notion.com/p/3e3e5855be3981e1ac1dc08cf5e9bbcd","title":"EV-0097"}}},
    {"evidence_id":"E0011","content":"1899年商法348条は、荷受人が留保なく荷物を受け取り運送賃等を支払うと運送人の責任は消滅する一方、直ちに発見できない毀損・一部滅失は引渡しから2週間以内に運送人へ通知すれば例外とした。","source_locator":"第348条","selection_reason":"引渡し後の毀損・一部滅失を検知・通知する期限統制を示すため。","note_type":"Data","direct_quote":null,"provenance":{"source":{"notion_url":"https://app.notion.com/p/3e3e5855be3981afa766c378de85f6b3","title":"商法（明治32年法律第48号）— 法令データベース"},"evidence_note":{"notion_url":"https://app.notion.com/p/3e3e5855be398175a0ebf2fc25d65172","title":"EV-0098"}}},
    {"evidence_id":"E0012","content":"1876年の彰真社と中牛馬会社の荷物運送約定は、中牛馬会社が荷物を受け取った後ただちに運送し、倉賀野河岸への送状と定められた日限に従って受取証を取り置き、後日の異論がないよう注意することを定めていた。","source_locator":"史料1-21「彰真社ト中牛馬会社ト荷物運送取扱ノ儀」第2条","selection_reason":"送状・期限・受取証を用いた遅延・受渡し紛争の統制を示すため。","note_type":"Data","direct_quote":null,"provenance":{"source":{"notion_url":"https://app.notion.com/p/3e3e5855be3981b486ade01100d45e8d","title":"近代日本における陸運企業の形成過程"},"evidence_note":{"notion_url":"https://app.notion.com/p/3e3e5855be398197803bfa3da8ad9880","title":"EV-0099"}}},
    {"evidence_id":"E0013","content":"1876年の彰真社と中牛馬会社の荷物運送約定は、輸送途中に荷物の濡れ・傷み・火災・盗難等が生じた場合、その責任を中牛馬会社に負わせ、速やかに弁償させることを定めていた。","source_locator":"史料1-21 第4条","selection_reason":"濡損・毀損・火災・盗難に対する明示的責任処理を示すため。","note_type":"Data","direct_quote":null,"provenance":{"source":{"notion_url":"https://app.notion.com/p/3e3e5855be3981b486ade01100d45e8d","title":"近代日本における陸運企業の形成過程"},"evidence_note":{"notion_url":"https://app.notion.com/p/3e3e5855be39815f94d2d7e11f3366a5","title":"EV-0100"}}},
    {"evidence_id":"E0014","content":"1876年の彰真社と中牛馬会社の荷物運送約定は、運送賃の一部を弁償の補いとして備える品目を設け、運送を怠る等の問題が生じた場合には受負人・保証人の所有物から弁償させることを定めていた。","source_locator":"史料1-21 第3条・第5条","selection_reason":"弁償原資・保証人による責任履行確保を示すため。","note_type":"Data","direct_quote":null,"provenance":{"source":{"notion_url":"https://app.notion.com/p/3e3e5855be3981b486ade01100d45e8d","title":"近代日本における陸運企業の形成過程"},"evidence_note":{"notion_url":"https://app.notion.com/p/3e3e5855be39819bbcfad2c68d642733","title":"EV-0101"}}},
    {"evidence_id":"E0015","content":"1876年の彰真社と中牛馬会社の荷物運送約定は、荷物の受払いで雨天または泥道で荷積みする際に粗略な取扱いをしないようにすることを定めていた。","source_locator":"史料1-21 第7条","selection_reason":"濡損・汚損を予防する具体的な取扱注意を示すため。","note_type":"Method","direct_quote":null,"provenance":{"source":{"notion_url":"https://app.notion.com/p/3e3e5855be3981b486ade01100d45e8d","title":"近代日本における陸運企業の形成過程"},"evidence_note":{"notion_url":"https://app.notion.com/p/3e3e5855be39815abbeefa92dc40959c","title":"EV-0102"}}},
    {"evidence_id":"E0016","content":"1899年商法332条は、運送人の請求がある場合に荷送人が運送状を交付し、運送品の種類、重量または容積、荷造の種類、個数・記号、到達地、荷受人、作成地・年月日を記載して署名することを定めた。","source_locator":"公布332条","selection_reason":"荷の内容・数量・荷造・記号・宛先を文書で対応付ける統制を示すため。","note_type":"Data","direct_quote":null,"provenance":{"source":{"notion_url":"https://app.notion.com/p/3e3e5855be3981f38761ee01c4b699c4","title":"332条（明治商法・明治32年）"},"evidence_note":{"notion_url":"https://app.notion.com/p/3e3e5855be398182a320e063ad94b31b","title":"EV-0076"}}},
    {"evidence_id":"E0017","content":"商法332条の修正案理由書は、当時の慣習として荷送人から運送人へ送状を渡し、運送人から荷送人へ受取証書または貨物引換証を渡す一方、小荷物では送状を付さないのが通例であったため、送状を常時必須とはしなかったと説明する。","source_locator":"商法修正案理由書・第三百三十一條","selection_reason":"文書統制が全荷物一律ではなかった境界条件を示すため。","note_type":"Claim","direct_quote":null,"provenance":{"source":{"notion_url":"https://app.notion.com/p/3e3e5855be3981f38761ee01c4b699c4","title":"332条（明治商法・明治32年）"},"evidence_note":{"notion_url":"https://app.notion.com/p/3e3e5855be39819b944ded9e24d802a9","title":"EV-0077"}}},
    {"evidence_id":"E0018","content":"1899年商法339条は、複数の運送人が相次いで運送する場合、各運送人が運送品の滅失・毀損・延着について連帯して損害賠償責任を負うと定めた。","source_locator":"公布339条","selection_reason":"中継者変更・複数運送人間で責任が切断されない統制を示すため。","note_type":"Data","direct_quote":null,"provenance":{"source":{"notion_url":"https://app.notion.com/p/3e3e5855be398120bf08e07bad46ee78","title":"339条（明治商法・明治32年）"},"evidence_note":{"notion_url":"https://app.notion.com/p/3e3e5855be3981a3a9b8e5030301fd6a","title":"EV-0080"}}},
    {"evidence_id":"E0019","content":"1899年商法337条は、運送人が、自己・運送取扱人・使用人等について運送品の受取・引渡・保管・運送に関する注意を怠らなかったことを証明しない限り、滅失・毀損・延着の損害賠償責任を免れないと定めた。","source_locator":"第337条","selection_reason":"受取・保管・運送・引渡し全体の注意義務と責任を示すため。","note_type":"Data","direct_quote":null,"provenance":{"source":{"notion_url":"https://app.notion.com/p/3e3e5855be3981afa766c378de85f6b3","title":"商法（明治32年法律第48号）— 法令データベース"},"evidence_note":{"notion_url":"https://app.notion.com/p/3e3e5855be398117a90ed9844e51dacc","title":"EV-0083"}}},
    {"evidence_id":"E0020","content":"1899年商法344条は、貨物引換証を作成した場合、運送品の引渡しは貨物引換証との引換えでなければ請求できないと定めた。","source_locator":"第344条","selection_reason":"引渡し権限を証券と結び付ける統制を示すため。","note_type":"Data","direct_quote":null,"provenance":{"source":{"notion_url":"https://app.notion.com/p/3e3e5855be3981afa766c378de85f6b3","title":"商法（明治32年法律第48号）— 法令データベース"},"evidence_note":{"notion_url":"https://app.notion.com/p/3e3e5855be39819fabcbdf2100f13639","title":"EV-0084"}}}
  ]
}
