{
  "schema_version": "2.1.0",
  "artifact_type": "10_evidence",
  "investigation_id": "INV-000032",
  "rq_id": "RQ-000032",
  "snapshot_at": "2026-09-28T11:42:00.000Z",
  "sources": [
    {
      "source_id": "SRC-000151",
      "source_revision": {
        "commit_sha": "934edd8625ff1d2cb0bdaab7cd732d1b3aec247b",
        "blob_sha": "32cd77650d017060fde2225a0408748ec7e71f27"
      },
      "accessed_at": "2026-09-28T05:49:00.000Z",
      "notion_url": "https://app.notion.com/p/3e9e5855be39816994bcdb04436bc2f6"
    },
    {
      "source_id": "SRC-000153",
      "source_revision": {
        "commit_sha": "2f2d8eb3d4dee09d7a4c1eb05fd52af4e5e29b88",
        "blob_sha": "4aa53537faaf9f417dc5ac010f2aedf8ab49d65a"
      },
      "accessed_at": "2026-09-28T11:42:00.000Z",
      "notion_url": "https://app.notion.com/p/3e9e5855be3981b0b5e4e6644d6fa1b5"
    }
  ],
  "evidence_items": [
    {
      "evidence_id": "E0001",
      "content": "Entry 0180『きさらぎ駅』は、D07で空間・経路異常（SPATIAL_ROUTE_ANOMALY）と隠れた／消失した場所、D13でSPATIAL_DISTORTION、D16でSEQUENTIAL_EPISODE、D18でL1、D21でA2を持つ。したがって、通常地理から別の位置体系へ接続される空間異常・段階進行・実在地アンカーという構造は既存corpusに存在する。",
      "source_locator": "workspace/articles/f8fe59b49c2e1e/docs/10_each_lore/0180_kisaragi_station/0180_20_analysis.json D07,D13,D16,D18,D21",
      "selection_reason": "候補A/C/E/Fの位置・経路再解釈構造と比較するため",
      "note_type": "Data",
      "direct_quote": null,
      "provenance": {
        "source_id": "SRC-000151",
        "evidence_note": null
      }
    },
    {
      "evidence_id": "E0002",
      "content": "Entry 0060『幽霊タクシー』は、D07=UNKNOWN_EXISTENCE、D10=GHOST_SPIRIT、D11=RIDE_BOARD、D13=MANIFEST_ONLY、D16=SINGLE_EPISODE、D17=OBSERVATIONAL_ONLY、D18=L1、D21=A2である。実在地アンカー＋単一エピソード＋超自然主体という構成は既存corpusに存在する。",
      "source_locator": "workspace/articles/f8fe59b49c2e1e/docs/10_each_lore/0060_ghost_taxi/0060_20_analysis.json D07-D18,D21",
      "selection_reason": "候補A/B/Dの単一エピソード・実在地依存構造との対照に使うため",
      "note_type": "Data",
      "direct_quote": null,
      "provenance": {
        "source_id": "SRC-000151",
        "evidence_note": null
      }
    },
    {
      "evidence_id": "E0003",
      "content": "Entry 0319『戦場ヶ原大蛇大百足』は、D07で地名由来・地名語源を直接表すChild不足をtaxonomy gapとして明示し、D08=PLACE_NAME_RUIN、D09=EVENT_ORIGIN、D11=LOCATION_STATE、D18=L1+L3、D21=A2を持つ。地名・場所identityそのものを意味形成対象にする場合、現行D07 taxonomyに不足が生じうる。",
      "source_locator": "workspace/articles/f8fe59b49c2e1e/docs/10_each_lore/0319_senjogahara_daija_oomukade/0319_20_analysis.json D07-D11,D18,D21",
      "selection_reason": "候補A/C/Dの名称・場所identity再配置が既存taxonomyでどう扱われるか比較するため",
      "note_type": "Data",
      "direct_quote": null,
      "provenance": {
        "source_id": "SRC-000151",
        "evidence_note": null
      }
    },
    {
      "evidence_id": "E0004",
      "content": "Entry 0362『豊川信用金庫取付け騒ぎ』は、D12=READER_LISTENER、D13=INFORMATION_INDUCED_ACTION、D15=MARKET_SOCIAL_BEHAVIOR、D16=SEQUENTIAL_EPISODE、D17=VERIFY_DEBUNK、D18=L3、D21=A4を持つ。実在史実を因果構造へ統合するA4と、情報が現実行動へ作用するL3の組合せは既存corpusに存在する。",
      "source_locator": "workspace/articles/f8fe59b49c2e1e/docs/10_each_lore/0362_toyokawa_shinkin_bank_run/0362_20_analysis.json D12-D18,D21",
      "selection_reason": "候補B/E/Fの現実インフラ・史実統合がA2かA4か、L1/L3のどちらに相当するかを比較するため",
      "note_type": "Data",
      "direct_quote": null,
      "provenance": {
        "source_id": "SRC-000151",
        "evidence_note": null
      }
    },
    {
      "evidence_id": "E0005",
      "content": "Entry 0198『ひとりかくれんぼ』は、D11=PERFORM_RITUAL、D12=PRACTITIONER、D13=PURSUIT、D16=SEQUENTIAL_EPISODE、D17=RITUAL_CLOSURE（secondary=PROCEDURAL_RULE）を持つ一方、D14とD15はUである。したがって発動条件・対象・作用・時間構造・終了規則は表現されるが、帰結方向と終端結果は未解決として保持される。",
      "source_locator": "workspace/articles/f8fe59b49c2e1e/docs/10_each_lore/0198_hitori_kakurenbo/0198_20_analysis.json D11-D17 (D14/D15=U)",
      "selection_reason": "RQ-000031候補のD17解除規則がtaxonomy上特異かを比較するため",
      "note_type": "Data",
      "direct_quote": null,
      "provenance": {
        "source_id": "SRC-000151",
        "evidence_note": null
      }
    },
    {
      "evidence_id": "E0006",
      "content": "Corpus内にはD07の既存Childで空間・経路異常を表現できるEntryがある一方、Entry 0319では『地名由来・地名語源』がD07 taxonomy gapと判定されている。これは、空間異常そのものと、名称・場所identityの意味形成を区別する必要があることを示す。",
      "source_locator": "0180_20_analysis.json D07 と 0319_20_analysis.json D07 の比較",
      "selection_reason": "候補A/C/Dの新規性が単なる空間異常ではなくidentity再配置にあるかを評価するため",
      "note_type": "Result",
      "direct_quote": null,
      "provenance": {
        "source_id": "SRC-000151",
        "evidence_note": null
      }
    },
    {
      "evidence_id": "E0007",
      "content": "Pinned upstream INV-000031/30_analysis.json defines six provisional creative candidates A–F. Candidate-side dimensions explicitly specified in candidate_hypotheses are D07, D09, D10, D11, D13, D15, D16, D17, D18. D01–D06 and D19–D20 are explicitly described in evidence_gaps as empirically unresolved/not currently codable. D08, D12, D14, D21 are not explicitly assigned in candidate_hypotheses; they must remain unassigned rather than inferred. The six candidate definitions and all dimension descriptions are design hypotheses, not observed folklore codings.",
      "source_locator": "research-atelier@ff9b35430b3bb2c88016f3843af768ffd860e909 investigations/INV-000031/30_analysis.json blob d9088ccd885d908b2f05f5d2ad494b5d30b37a1a profile.candidate_hypotheses + profile.evidence_gaps",
      "selection_reason": "候補A-Fを比較の一方としてEvidence layerにimmutable provenance付きで固定するため",
      "note_type": "Data",
      "direct_quote": null,
      "provenance": {
        "source_id": "SRC-000153",
        "evidence_note": null
      }
    },
    {
      "evidence_id": "E0008",
      "content": "Pinned 0015_zenn corpus snapshot contains 25 canonical *_20_analysis.json Entries. corpus_snapshot.json records, for every Entry, blob SHA plus D01-D21 status/primary/secondary and aggregates their frequencies. Key full-corpus results: D16 status U=1/I=12/D=12; primary SEQUENTIAL_EPISODE=10, DEADLINE=4, SINGLE_EPISODE=2. D17 status U=10/I=11/D=4, so control/escape is unresolved in 40% and heterogeneous when coded. D18 primary L1=22/L2=1/L3=2; D21 primary A0=2/A1=10/A2=7/A4=6. Exact D07-D10 tuples including status, primary and secondary are 25 unique combinations across 25 Entries. D07 primary UNKNOWN_EXISTENCE is the most frequent single D07 primary (7/25). No observed D10 primary/secondary code in this pinned corpus represents an infrastructure/network causal source.",
      "source_locator": "investigations/INV-000032/corpus_snapshot.json blob 74b6741df443057e7197ccae0a1112472b8f4f36; source corpus commit 8f69a1aec1955229cc1c3b6c2591a07c3b657265; 25 per-Entry blob SHAs preserved in entries[]",
      "selection_reason": "review F001/F004に対応し、population-level prevalence/distinctivenessを全pinned corpusから機械集計するため",
      "note_type": "Result",
      "direct_quote": null,
      "provenance": {
        "source_id": "SRC-000151",
        "evidence_note": null
      }
    }
  ]
}
